{
  "$schema": "../../schema/extension_schema.json",
  "layer": "L2_fnb_industry_extension",
  "version": "1.0.2",
  "extends": "L1_universal_organization_ontology",
  "compatible_core_version": "2.1.0",
  "description": "餐饮行业 extension ontology 数据，覆盖餐饮门店、菜品、供应链、订单与顾客关系等核心概念。",
  "description_en": "Food & Beverage Industry extension ontology covering restaurant outlets, menus, supply chain, orders, and customer relationships.",
  "classes": [
    {
      "id": "Restaurant",
      "label_zh": "餐厅门店",
      "label_en": "Restaurant",
      "parent": "OrgUnit",
      "definition": "提供实体餐饮及接待服务的终端营业场所。",
      "definition_en": "A terminal physical establishment providing food, beverages, and hospitality services."
    },
    {
      "id": "CentralKitchen",
      "label_zh": "中央厨房",
      "label_en": "Central Kitchen",
      "parent": "OrgUnit",
      "definition": "集中进行食材初步加工或半成品制作的枢纽节点。",
      "definition_en": "A centralized hub for preliminary processing of ingredients or semi-finished products."
    },
    {
      "id": "DistributionCenter",
      "label_zh": "物流配送中心",
      "label_en": "Distribution Center",
      "parent": "OrgUnit",
      "definition": "餐饮物料及冷链分发的区域仓储中心。",
      "definition_en": "Regional storage center for the dispatch of catering materials and cold chain."
    },
    {
      "id": "DiningArea",
      "label_zh": "就餐区",
      "label_en": "Dining Area",
      "parent": "OrgUnit",
      "definition": "前厅即供顾客用餐及休憩的划分空间。",
      "definition_en": "Front-of-house area demarcated for customer dining and rest."
    },
    {
      "id": "KitchenArea",
      "label_zh": "后厨区",
      "label_en": "Kitchen Area",
      "parent": "OrgUnit",
      "definition": "后场专门进行备餐及烹饪的受控区域。",
      "definition_en": "Back-of-house controlled area dedicated to food preparation and cooking."
    },
    {
      "id": "MenuProduct",
      "label_zh": "菜单单品",
      "label_en": "Menu Product",
      "parent": "ProductService",
      "definition": "向终端顾客售卖的独立餐饮单品 SKU。",
      "definition_en": "Standalone consumable food SKU sold to end customers."
    },
    {
      "id": "ComboMeal",
      "label_zh": "固定套餐",
      "label_en": "Combo Meal",
      "parent": "ProductService",
      "definition": "多个菜单单品组合绑定的销售单元。",
      "definition_en": "A composite sales unit binding multiple menu items together."
    },
    {
      "id": "TakeawayPackaging",
      "label_zh": "包装耗材",
      "label_en": "Takeaway Packaging",
      "parent": "Resource",
      "definition": "随餐具送出、用于包装防溢或承载的外带消耗品。",
      "definition_en": "Consumable takeaway packing applied for containment and spill prevention."
    },
    {
      "id": "Franchisee",
      "label_zh": "特许经营商",
      "label_en": "Franchisee",
      "parent": "Organization",
      "definition": "出资并获权实际承接品牌分店运营体系的外部组织。",
      "definition_en": "External organizations investing in and authorized to run the brand branch."
    },
    {
      "id": "FoodSupplier",
      "label_zh": "食品供应商",
      "label_en": "Food Supplier",
      "parent": "Organization",
      "definition": "供应生鲜、半成品或包装材料的外部机构。",
      "definition_en": "External institution supplying fresh, semi-finished, or packaging materials."
    },
    {
      "id": "StoreManager",
      "label_zh": "店长",
      "label_en": "Store Manager",
      "parent": "Role",
      "definition": "对单一门店各项人货流KPI全权负责的运营骨干。",
      "definition_en": "Operational leader fully accountable for an individual store's KPIs."
    },
    {
      "id": "Chef",
      "label_zh": "厨师/制餐员",
      "label_en": "Chef",
      "parent": "Role",
      "definition": "执行餐饮核心制作 SOP 的后厨人员。",
      "definition_en": "Kitchen personnel executing core culinary SOPs."
    },
    {
      "id": "DeliveryRider",
      "label_zh": "外卖骑手",
      "label_en": "Delivery Rider",
      "parent": "Role",
      "definition": "承接外带订单将其物流送达C端的派送人员。",
      "definition_en": "Dispatch personnel delivering ordered food to the end consumer."
    },
    {
      "id": "FoodPreparation",
      "label_zh": "备餐制餐",
      "label_en": "Food Preparation",
      "parent": "Process",
      "definition": "从预热出库到组装打包餐品的关键生产活动。",
      "definition_en": "Core production activity spanning from prep to assembly and packaging."
    },
    {
      "id": "FoodOrder",
      "label_zh": "餐饮订单",
      "label_en": "Food Order",
      "parent": "Event",
      "definition": "单一顾客消费行为所产生的履约合约与流水。",
      "definition_en": "The fulfillment contract and transaction generated by a patron's consumption."
    },
    {
      "id": "FoodSafetyInspection",
      "label_zh": "食安飞检",
      "label_en": "Food Safety Inspection",
      "parent": "Process",
      "definition": "确保全链条合规性、控制过期或卫生风险的安全审计。",
      "definition_en": "Safety audits ensuring full-chain compliance and mitigating hygiene risks."
    },
    {
      "id": "Ingredient",
      "label_zh": "食材",
      "label_en": "Ingredient",
      "parent": "Resource",
      "definition": "供制餐消耗的原始食物级物料。",
      "definition_en": "Raw food-grade material to be consumed in preparation."
    },
    {
      "id": "KitchenEquipment",
      "label_zh": "后厨设备",
      "label_en": "Kitchen Equipment",
      "parent": "Resource",
      "definition": "用于餐饮粗细加工的电器或高值固定资产。",
      "definition_en": "Appliances or high-value fixed assets used in culinary prep."
    },
    {
      "id": "Recipe",
      "label_zh": "产品配方",
      "label_en": "Recipe",
      "parent": "Document",
      "definition": "指导厨房如何搭配定量食材与加工标准的图文数字资产。",
      "definition_en": "Digital/text asset standardizing quantitative ingredient mixes and processing."
    }
  ],
  "attributes": [],
  "relations": [
    {
      "id": "operates_restaurant",
      "domain": "Franchisee",
      "range": "Restaurant",
      "definition": "特许经营商出资并主理指定门店"
    },
    {
      "id": "supplies_ingredient",
      "domain": "FoodSupplier",
      "range": "Ingredient",
      "definition": "供应商向品牌输送食品原料"
    },
    {
      "id": "managed_by",
      "domain": "Restaurant",
      "range": "StoreManager",
      "definition": "门店由一位具体的店长全权管理"
    },
    {
      "id": "contains_product",
      "domain": "ComboMeal",
      "range": "MenuProduct",
      "definition": "实体套餐绑定特定的单品组合"
    },
    {
      "id": "requires_ingredient",
      "domain": "MenuProduct",
      "range": "Ingredient",
      "definition": "单项成品售卖前需要消耗设定的原料"
    },
    {
      "id": "guided_by_recipe",
      "domain": "FoodPreparation",
      "range": "Recipe",
      "definition": "制餐过程必须遵循SOP配方的要求与规程"
    },
    {
      "id": "includes_packaging",
      "domain": "FoodOrder",
      "range": "TakeawayPackaging",
      "definition": "外带/外卖订单需要使用配给的包材"
    }
  ]
}
